,response_latest_time,post_title,post_url,author_name,author_url,response_count,possible_price,addr_coords,addr_name,transit_minutes
2877,2022-03-02 09:36:00,个人转租，太阳宫新纪家园20平主卧3200,https://www.douban.com/group/topic/261323023/,T先生,https://www.douban.com/people/170373440/,3,3200.0,"116.450033,39.973626",北京市朝阳区太阳宫乡新纪家园,15.0
1172,2022-03-06 15:51:00,转租 朝阳太阳宫 三元桥｜ 西坝河东里两室大次卧，3200无中介费,https://www.douban.com/group/topic/261678073/,聆风,https://www.douban.com/people/195895937/,0,3200.0,"116.439588,39.972991",北京市朝阳区太阳宫乡圣馨家园,22.0
4280,2022-02-26 14:05:00,精装主卧3600/月，东大桥，呼家楼商圈，房东直租，关东店北街21号楼，照片实图，紧邻地铁10号/6号线100米内,https://www.douban.com/group/topic/261026882/,红叶,https://www.douban.com/people/244834035/,0,3600.0,"116.456176,39.923055",北京市朝阳区呼家楼街道关东店北街21号楼北京保罗商务会馆,22.0
1604,2022-03-05 14:07:00,转租东直门察慈小区南向主卧一间3500元,https://www.douban.com/group/topic/261594683/,睡不醒的螃蟹,https://www.douban.com/people/47185153/,0,3500.0,"116.439872,39.942734",北京市东城区东直门街道北京中煤宾馆,23.0
3865,2022-02-27 15:37:00,东直门地铁站，察慈小区，单间16平，3500元，房东直租,https://www.douban.com/group/topic/261111381/,木夕365,https://www.douban.com/people/137958590/,2,3500.0,"116.439872,39.942734",北京市东城区东直门街道北京中煤宾馆,23.0
4827,2022-02-25 09:29:00,东直门地铁站附近员工公寓直租 单人1200/月起 整租6500/月 私豆油,https://www.douban.com/group/topic/260930849/,秋实诶,https://www.douban.com/people/153804129/,1,3850.0,"116.435102,39.942352",北京市东城区东直门街道国盛中心航空服务大厦,25.0
2206,2022-03-03 20:43:00,业主直租 地铁十四号线北工大地铁站 十号线潘家园地铁站 下地铁五六分钟直达小区4200 精装修大开间一居室 V13693290051,https://www.douban.com/group/topic/261457814/,A.     苏凉🌞,https://www.douban.com/people/243282724/,6,4200.0,"116.460926,39.875387",北京市朝阳区潘家园街道潘家园(地铁站)潘家园旧货市场,26.0
2504,2022-03-02 23:11:00,【房东直租】10号线 13号线 知春路地铁站 主卧3500,https://www.douban.com/group/topic/261390298/,嘘嘘,https://www.douban.com/people/175197775/,6,3500.0,"116.341372,39.976473",北京市海淀区花园路街道知春路,28.0
